{
  "repository": "contract-demo",
  "branch": "local-fix",
  "created_at": "2026-01-02T03:04:05+00:00",
  "selected_fingerprints": [
    "21f45dd073196987b41d",
    "3d7a3fddcf9f3c971b6d",
    "67ffb800811269d28bc9",
    "752ff8b89f59b1434666",
    "b96973082fc45c6ad55e",
    "bcd4fab770d4b25f5d1a"
  ],
  "changed_files": [
    "package-lock.json"
  ],
  "rescan_passed": true,
  "remaining_selected": [],
  "finding_count": 0,
  "checks_passed": true,
  "checks_skipped": false,
  "checks": [],
  "proof": "707f9efa24245e08d368140b9d433f3009388fcdc8f69dd12d052e012e1048ae"
}
